제목,게시자,구독자수,조회수,게시일
목숨걸고 only 벤트만 타는 미친 광부. 짜릿해!! 우주하마 어몽어스,우주하마,105만명,67168,2020.9.27
어몽어스 처음 하는데 뭐냐 이거..,조우,15.5만명,4500,2020.9.27
좁은 방에 임포스터랑 갇히면 생기는 일...,혜안,80만명,268610,2020.9.27
미쳐버린 어몽어스 컨셉충들 ㅋㅋㅋㅋㅋㅋㅋㅋㅋㅋㅋㅋ,빅헤드,47.5만명,153335,2020.9.27
어몽어스는 모두 착한 사람만 있는 거 같습니다 - 어몽어스,루태TV,48.4만명,3590,2020.9.27
이 맵 처음 해봅니다만...? [어몽어스],JUNE,53.4만명,149363,2020.9.27
어몽어스에 진지한사람이 지는 게임ㅋㅋㅋㅋㅋ,악동 김블루,177만명,306563,2020.9.26
벤트 목격자 죽을 때까지 쫓아가기 ㅋㅋㅋㅋ [어몽어스],킴성태TV,100만명,310252,2020.9.26
개 쩌는 임포스터 공략!! 확시 보여주는 척 다 죽이기ㅋㅋㅋㅋㅋㅋ,혜안,80만명,840934,2020.9.20
할명수 ep.06｜추격전의 달인 조커 박명수 어몽어스(among us) 도전,JTBC Entertainment,593만명,75791,2020.9.25
올 때까지 기다리다가 문 닫고 암살하는 미친 임포스터 ㄷㄷ,혜안,80만명,462671,2020.9.26
"전혀 성장하지 않았어" [ 강백대전 어몽어스 2차전 ],소니쇼게임방송,18.7만명,38269,2020.9.27
투표를 마음대로 조종해서 모두를 죽이는 신종 핵쟁이 [어몽어스],주키니TV,38.7만명,660131,2020.9.22
어몽어스 투명 임포스터 하는법?! 벤트 없이 땅에 들어가는 핵버그? - 어몽 어스 모바일 애니메이션,동동 TV,33.9만명,166084,2020.9.25
커플은 어몽어스에서 서로 안 죽일까? *어몽어스 10인 풀파티*,잠뜰 TV,193만명,722356,2020.9.23
어몽어스 10명이 다 멍청하면 생기는일ㅋㅋㅋ (1편),김재원의 즐거운 세상,164만명,804416,2020.9.11
김봉준믹서기 임아니 [어몽어스],임아니[임아니TV],2.72만명,76406,2020.9.26
어몽어스로 떼부자가 된 100만 유튜버,우주하마,105만명,1301998,2020.9.16
벤트 1회당 천원 미션이요? 바로 시작합ㄴ.... [어몽어스],주키니TV,38.7만명,1004941,2020.9.15
임포 킬나기 전에 잡는 법 [어몽어스],JUNE,53.4만명,262935,2020.9.23
파랑이 남매가 임포스터가 된다면? (어몽어스) [PrettyHerb 쁘띠허브],쁘허,97.3만명,201700,2020.9.23
역대급 레전드판 나왔습니다!!! 혼자서 5명을 죽인 임포스터 ㄷㄷ,혜안,80만명,475059,2020.9.25
고인물 임포스터가 크루원 괴롭히는 방법ㅋㅋㅋㅋㅋ[어몽어스33화],쉐어TV,16.9만명,123483,2020.9.26
어몽어스 임포스터 신기록(?) 23초컷,군림보,79.5만명,932526,2020.9.14
[마인크래프트] 어몽어스로 변신해서 쪼그만 펫친구들을 잘 돌봐줬어요!!! 어몽어스 모드!,돼지저금통,71.8만명,116505,2020.9.26
어몽어스 맛있게 하는 법 ｜국밥형 임포스터,튜브김민교,29.7만명,244141,2020.9.26
죽이고 CCTV 보는 척했더니 아무도 모릅니다?! - 어몽어스,루태TV,48.4만명,125267,2020.9.25
어몽어스 개빡겜 딱 1판 해봤습니다. 숨막히는 추격전 레전드,우주하마,105만명,1906122,2020.9.1
놀라지마세요. 어몽어스 한 턴에 끝내는 방법 알려드립니다,혜안,80만명,1371736,2020.8.31
임포스터 죽여주는 미친 필살기 공개합니다!! 우주하마 어몽어스,우주하마,105만명,1220205,2020.9.12
페이커식 어몽어스 플레이... 🚨경크경크🚨 [T1 Stream Highlight],T1,64.6만명,684228,2020.9.24
살인 목격자도 내편으로 만드는 임포스터 노하우 ㅋㅋㅋ [어몽어스 29화],쉐어TV,16.9만명,327449,2020.9.21
3연속 더블킬?! 이거 가능한거였어....? 지렸다.... _ 어몽어스,자몽티비,47.5만명,83828,2020.9.26
*어몽어스* 임포스터 정치질 레전드 ㅋㅋㅋ,잠뜰 TV,193만명,808534,2020.9.16
"배신도 전략이다" 동료 버리고 하드캐리하는 임포스터 [어몽어스 32화],쉐어TV,16.9만명,223999,2020.9.24
😈들켜도 당황하지마! 이렇게 하면 살수 있어!!!,군림보,79.5만명,546010,2020.9.23
신고를 했는데 왜 저만 회의에 참석을 못하죠? [어몽어스],주키니TV,38.7만명,482551,2020.9.26
시체를 몸으로 숨겼더니 아무도 모릅니다!? - 어몽어스,루태TV,48.4만명,290251,2020.9.11
벤트 없이 땅에 들어가는 역대급 끝판왕 핵유저 [어몽어스],주키니TV,38.7만명,693653,2020.9.24
다가오는 사람은 다 죽여버리는 눈사람 임포스터 [김계정 어몽어스],김계정,42만명,862951,2020.9.8
내가 움직일 수 없는 이유 (※따라하지 마세요) [어몽어스],JUNE,53.4만명,290119,2020.9.18
40대들만 모아서 어몽어스를 한다면? 내가 제일 막내라니.. - 틀몽어스 1화,우왁굳의 게임방송,106만명,493312,2020.9.26
벤트 장인이 알려주는 벤트 200% 활용 방법 [어몽어스],주키니TV,38.7만명,911044,2020.9.5
대놓고 벤트로만 이동하는 임포스터의 충격적인 반전 [어몽어스],주키니TV,38.7만명,826195,2020.9.17
10만원 걸고 어몽어스 대회열다ㅋㅋㅋㅋ(흔한게임),흔한남매,207만명,1046065,2020.9.12
😈신고 한번 없이 한턴에 시민 다 죽여버리는 미친 임포스터ㅋㅋㅋㅋ,군림보,79.5만명,791207,2020.9.18
어몽어스에서 너무잘하면 생기는일,꿀탱탱,48.2만명,657806,2020.8.30
혼자서 다 죽이고 승리!! 이 맛에 임포스터 합니다 [어몽어스],킴성태TV,100만명,495407,2020.9.17
어몽어스 미라맵(mira) 쉽게 이기는 천재적인 방법ㅋㅋㅋㅋ미쳤습니다...,혜안,80만명,732078,2020.9.12
😈임포스터만의 궁극기 활용법,군림보,79.5만명,371701,2020.9.24
어몽어스 1급 사기자리를 발견한 연쇄살인마 공주님👸,우주하마,105만명,2141400,2020.8.24
임포 2명이 같이 있으면 아무도 모릅니다?! - 어몽어스,루태TV,48.4만명,79516,2020.9.26
🌴제가 나무처럼 보이나요ㅡ?ㅋㅋㅋㅋ 우주하마 어몽어스,우주하마,105만명,713882,2020.9.26
(약)범죄자들이 모여서 어몽어스를 한다면 어떨까?,빅헤드,47.5만명,247256,2020.9.22
어몽어스 색깔을 마음대로 바꾸는 핵ㄷㄷ 개소름... 우주하마,우주하마,105만명,2040647,2020.9.6
어몽어스 극한의 고인물 설정 플레이,도현,22.9만명,62617,2020.9.27
사람들 다보는데 대놓고 벤트타기ㅋㅋㅋㅋㅣ어몽어스,저라뎃 JUSTLIKETHAT,54.8만명,290108,2020.9.25
대놓고 죽이고도 안걸리는 방법?! [어몽어스],킴성태TV,100만명,573557,2020.9.12
방에서 안 나갔더니 다들 너무 친해졌습니다 - 어몽어스,루태TV,48.4만명,96738,2020.9.23
최초의 길막 임포스터!! 공사중 돌아가시오🚧의 미친 플레이. 우주하마 어몽어스,우주하마,105만명,1357327,2020.9.13
소름 돋는 IQ 400 미친 임포스터의 설계... 시민들을 가지고 놈 ㄷㄷㄷㄷ,군림보,79.5만명,475095,2020.9.22
시민 앞에서 대놓고 죽이고 임포스터로 몰아가기ㅋㅋㅋㅋㅋㅋ,혜안,80만명,723329,2020.9.15
감스트 어몽어스 처음인데.. 미친실력!! 말이안나온다 진심,감스트GAMST,188만명,1768386,2020.8.29
어몽어스 유저들을 100% 농락하는 전설의 검ㅎㄷㄷ 우주하마,우주하마,105만명,1424397,2020.9.7
벤트타고 죽음을 배달하는 쿠팡맨 등장!!! [어몽어스 22화],쉐어TV,16.9만명,331610,2020.9.13
이 미친 임포스터는 IQ300 천재입니다. 우주하마 어몽어스,우주하마,105만명,1453582,2020.9.8
모두가 비명 지른 0.1초 차이로 갈리는 승패 어몽어스,우주하마,105만명,1633403,2020.8.28
어몽어스에서 당신을 변호해드립니다 1vs8 임포스터 레전드,우주하마,105만명,1703843,2020.8.22
어몽어스 천하제일 컨셉대회가 열렸습니다!! 그와중에 임포스터. 우주하마,우주하마,105만명,1168519,2020.9.5
세계최초 99% 은신 임포스터 ㅡ의 미친암살 레전드!! 우주하마 어몽어스,우주하마,105만명,3492479,2020.9.2
(레전드) 임포스터들 말문을 막아버리는 센서보고 추리하기,빅헤드,47.5만명,371892,2020.9.21
정직하게 플레이 했습니다 (트롤 X 반전주의) [어몽어스],JUNE,53.4만명,263428,2020.9.17
패드립하는 컨셉충 참교육하기 ㅋㅋㅋㅋㅋ(어몽어스),빅헤드,47.5만명,276186,2020.9.9
드디어 *어몽어스* 해봤다! 10인 풀파티,잠뜰 TV,193만명,1375566,2020.9.6
펫을 이용해서 동선추리 잘하는 방법! [어몽어스 31화],쉐어TV,16.9만명,198421,2020.9.23
거미 컨셉으로 역대급 레전드를 쓴 임포스터 "Uzuhama Among Us",우주하마,105만명,1157758,2020.9.19
페이커: 어몽어스 제대로 배워왔습니다 [Faker Stream Highlight],T1 Faker,116만명,589879,2020.9.25
싸이코 비둘기 - 우주하마 어몽어스,우주하마,105만명,1374870,2020.9.11
🍔『어몽어스 빅맥송』으로 컨셉 술래잡기 ㅋㅋㅋㅋㅋ,연다,88만명,159120,2020.9.26
버그 때문에 강제로 핵쟁이가 되어버렸습니다;; [어몽어스],주키니TV,38.7만명,2119795,2020.9.11
0.1%만 성공한다는 "어몽어스 빅맥송 챌린지"에 도전하세요! [어몽어스 28화],쉐어TV,16.9만명,353200,2020.9.19
임포스터 이렇게 잘 하는 사람들 처음 봄 - 어몽어스 일반인특집,빅헤드,47.5만명,279875,2020.9.12
상대 무빙만 보고 임포맞추는 플레이 [어몽어스],JUNE,53.4만명,373697,2020.9.12
닉네임 '혜안'으로 어몽어스 해봤습니다 ..,혜안,80만명,795058,2020.9.10
크루원으로 임포스터를 암살하는 방법 찾아냄 (어몽어스),빅헤드,47.5만명,745493,2020.9.6
어몽어스 버그때문에 억울하게 죽었습니다....,김재원의 즐거운 세상,164만명,927686,2020.9.3
의무실 확시를 하면 안되는 이유 [어몽어스],주키니TV,38.7만명,747524,2020.9.19
멘사회원 10명 모아서 플레이 해봤습니다 역대급 어몽어스 [어몽어스],JUNE,53.4만명,438934,2020.9.2
임포 자수하게 만드는 비밀 치트키 [어몽어스 26화],쉐어TV,16.9만명,310374,2020.9.17
어몽어스하면서 가장 말이 많아지는 순간,김재원의 즐거운 세상,164만명,1088405,2020.9.1
김재원의 첫 어몽어스 첫 임포스터 [우주마피아],김재원의 즐거운 세상,164만명,1109051,2020.8.26
시체 몸으로 숨기기 재도전 했습니다 - 어몽어스,루태TV,48.4만명,141431,2020.9.15
한명만 계속 죽여서 어몽어스 접게 하기 ㅋㅋㅋㅋ,킴성태TV,100만명,692961,2020.9.1
[세계최초공개] 너무 잔인해서 곧 막힐 "역주행 벤트쇼" [어몽어스 23화],쉐어TV,16.9만명,438717,2020.9.14
통신실에서 나오는 소리가 진짜 모스부호였다니..!! | 어몽어스 스토리 2화,힘쎈너구리,20.1만명,256345,2020.9.24
난 돌입니다 [어몽어스],JUNE,53.4만명,342517,2020.9.14
세계적인 명문대 오클랜드 졸업생들이 어몽어스를 한다면? - 일반인 특집,빅헤드,47.5만명,148422,2020.9.26
어몽어스에도 핵이 있습니다..1초 만에 다 죽이고 끝냄ㄷㄷ,혜안,80만명,2165804,2020.8.26
닉네임에 생일이라고 했더니 모두 축하해줬습니다 - 어몽어스,루태TV,48.4만명,66135,2020.9.22
흔한남매 어몽어스 첫 도전! 과연???ㅋㅋㅋㅋ(흔한게임),흔한남매,207만명,1836535,2020.9.5
멸치의 다이어트 꿀팁ㅋㅋㅋ (ft.어몽어스 모르는 멸치),급식걸즈,40.2만명,212839,2020.9.26
컨셉충을 잡는 컨셉충 [어몽어스],JUNE,53.4만명,320467,2020.9.9
어몽어스 하는데 나빼고 모두가 여자일때 생기는일ㅋㅋㅋㅋㅋㅋㅋ,콩콩이다,27.2만명,29309,2020.9.26
채팅만으로 임포스터 잡아내는 저는 어몽어스 무당입니다. 개소름,우주하마,105만명,2021779,2020.8.21
어몽어스를 잘하고 싶다면 바보인 척을 하세요. 핵소름,우주하마,105만명,3375885,2020.8.15
IQ 187이 각잡고 제대로 플레이하면 벌어지는 일들... _어몽어스,자몽티비,47.5만명,163458,2020.9.10
IQ 156 멘사회원이 어몽어스 플레이 하면 벌어지는일 [어몽어스],JUNE,53.4만명,448831,2020.8.27
상대가 아예 찾을 수 없는 방법 [어몽어스],JUNE,53.4만명,490094,2020.9.7
극한으로 즐거운 어몽어스 - 헬창편,김계정,42만명,619211,2020.9.20
어몽어스 닉네임이 캐릭터와 다른 색깔이면?! 역대급 헬 난이도 ㅋㅋㅋㅋㅋ [어몽어스],연다,88만명,290101,2020.9.17
어몽어스 닉네임을 군림보로 해봤는데ㅋㅋㅋㅋㅋ,군림보,79.5만명,305018,2020.9.16
실화 100% 귀신 본 이야기.. 어몽어스에 유령핵 등장ㄷㄷ 개소름,우주하마,105만명,1136735,2020.9.14
당신이 몰랐던 어몽어스에 관한 10가지 사실,택하기 Tekhagi,4.68만명,1382218,2020.8.26
어몽어스에서 본 미친 컨셉충들ㅋㅋㅋㅋㅋㅋ(우주마피아),김재원의 즐거운 세상,164만명,704943,2020.8.28
(레전드)우리팀 임포스터가 너무 빨리 죽었어요. 그래도... (어몽어스),빅헤드,47.5만명,260256,2020.9.24
내 키보드를 제어하는핵(;;)과 잠수타는임포스터ㄷㄷ쩐다,우주하마,105만명,881404,2020.9.22
어몽어스에서 나대서 죄송합니다,김재원의 즐거운 세상,164만명,603069,2020.9.8
☢️어몽어스 핵쟁이를 처음으로 두 명이나 만났습니다 ㄷㄷ,연다,88만명,199473,2020.9.18
🔥핵포스터가 휩쓸고 간 충격적인 사건 현장 ㄷㄷㄷㄷ,군림보,79.5만명,566373,2020.9.21
어몽어스 처음하는 몽린이 농락하기.. 너무 귀엽네요ㅋㅋㅋㅋㅋ ㅠㅠ,혜안,80만명,1115269,2020.9.4
어몽 1일차 뜨끈한 국밥들 가지고놀기 ㅋㅋㅋㅋ [어몽어스],킴성태TV,100만명,482432,2020.9.7
어몽어스 1일차 아무도 저를 죽이지 않습니다...,튜브김민교,29.7만명,319934,2020.9.16
결국 미쳐버린 즐겜유저들의 어몽어스 (2탄),김재원의 즐거운 세상,164만명,611511,2020.9.12
초딩들이랑 어몽어스를 한다면 어떻게 될까? ㅋㅋㅋ - 잼몽어스 1화,우왁굳의 게임방송,106만명,495610,2020.9.14
시청자까지 싹다 발발 떨었던 공포의 30초. 우주하마 어몽어스,우주하마,105만명,1496562,2020.9.4
30일동안 만든 역대급 고퀄 어몽어스 맵 최초공개?! 와.. 지려따.. _ 마인크래프트,자몽티비,47.5만명,95058,2020.9.25
너무 화가 납니다.. 어몽 접어야겠네요 [어몽어스],킴성태TV,100만명,387385,2020.9.11
'보라 여친'으로 했더니 보라색의 태도가... ㅋㅋㅋㅋ :: 어몽어스,밍모,52.9만명,28001,2020.9.23
분명 죽이는걸 봤는데.. 역대급 반전이 있었습니다;; [어몽어스],킴성태TV,100만명,611135,2020.9.6
어몽어스 연기대상,수힛suweet,2.35만명,73477,2020.9.20
꿀탱탱 어몽어스 처음했을때 ㅋㅋ그때도잘함?,꿀탱탱,48.2만명,410312,2020.9.11
벤트아래 살면서 모조리 낚는 살인마 "까꿍맨" [어몽어스 17화],쉐어TV,16.9만명,411974,2020.9.7
임포스터로 죽여놓고 다른 사람한테 덮어씌우는 법 ㅋㅋㅋㅋㅋㅋ (어몽어스),빅헤드,47.5만명,1088204,2020.8.22
맵 반대로 만들어서 플레이 하는법 버그아님! [어몽어스],JUNE,53.4만명,275103,2020.9.16
어몽어스 1분컷,군림보,79.5만명,503982,2020.9.7
어몽어스에서 IQ200 인증 했습니다 [어몽어스],뜨뜨뜨뜨,154만명,419654,2020.8.27
벤트 타다가 걸리는 유형ㅋㅋㅋㅋㅋ 그것이 실제로 일어났습니다 [웃소 어몽어스],웃소 게임즈,8.69만명,534778,2020.9.22
어몽어스 한국 서버에서 외국인인척 다 죽이기ㅋㅋㅋㅋㅋ,혜안,80만명,980311,2020.8.18
국밥 컨셉 잡는 릴카에게 당해버렸습니다.. [어몽어스],킴성태TV,100만명,545123,2020.8.31
살인현장 목격하고 모른척 가지고 놀기 ㅋㅋㅋㅋ [어몽어스],킴성태TV,100만명,648049,2020.8.25
수상하다고 따라가지 마세요.. [어몽어스],킴성태TV,100만명,512669,2020.9.10
이 맵에 거울있는거 아셨나요? 거울보면안됩니다. [어몽어스 27화],쉐어TV,16.9만명,264169,2020.9.18
*어몽어스 술래잡기* 진짜 꿀잼인데???,뽁구BBokTV,40.8만명,91504,2020.9.10
멍청한 임포스터가 확시인 사람을 몰아가면 생기는 일 어몽어스ㅋㅋㅋ,코아 TV,64만명,246972,2020.9.18
"그만 괴롭혀 미X놈아!" 폭발한 신입사원ㅋㅋㅋㅋ 회사원 컨셉 어몽어스미쳤냐ㅋㅋㅋ,악동 김블루,177만명,290710,2020.9.25
어몽어스 버그 때문에 임포스터를 잡아버린 크루원 ㅋㅋㅋ,안내메시지,11.7만명,90448,2020.9.16
어몽 하위 20퍼센트는 못 찾는 시체 위치 [어몽어스],킴성태TV,100만명,401284,2020.9.15
어몽어스에서 극한의 인성질 했더니 결국 폭발함ㅋㅋㅋㅋㅋㅋ,콩콩이다,27.2만명,26540,2020.9.25
어몽어스를 너무 많이 한 안전가족 3화,행동이아빠,1.27만명,107433,2020.9.26
어몽어스 시작 전에 CCTV실에서 태어나는 방법... 이거 모르면 님만손해임,살타 Salta,8.31만명,998670,2020.8.30
살생을 하지않는 미친킬러 스님. 우주하마 어몽어스,우주하마,105만명,1097163,2020.9.23
모두를 당황시킨 뻔뻔한 임포스터식 투표 ㅋㅋㅋㅋㅋㅋ (어몽어스),빅헤드,47.5만명,454195,2020.9.11
제가 너무 잘해서 저만보면 죽이네요ㅠㅠ [어몽어스],킴성태TV,100만명,423933,2020.9.8
실친들과 어몽어스 해봤습니다 (감성추리 욕설주의),오킹TV,92.6만명,684574,2020.9.1
심리학전공끼리 어몽어스를 하면 어떻게 될까? - 어몽어스 일반인특집,빅헤드,47.5만명,403511,2020.9.4
어몽어스 투표핵 만나서 더블 벤트쇼 성공? 크루원이 임포스터 당황하게 하는법! - 어몽 어스 모바일 애니메이션,동동 TV,33.9만명,109085,2020.9.22
전혀 수상하지 않은 부부의 임포스터 사기극ㅋㅋㅋ [김계정 어몽어스],김계정,42만명,827145,2020.8.30
성격 개급해서 1분13초만에 끝내는 우주하마 레전드 어몽어스 플레이,우주하마,105만명,2213624,2020.8.26
어몽어스2 제작 취소? 결국은 포기해버린 개발자들의 논리 / 신규 맵 소식,허언 빽형,7.99만명,336,2020.9.27
어몽어스 절대 이렇게 하지 마세요...ㅋㅋㅋㅋㅋ,꽈뚜룹 Quaddurup,116만명,633668,2020.8.27
사람이 오면 문 닫고 죽이는 사이코패스 임포스터ㅋㅋㅋㅋ,군림보,79.5만명,1110896,2020.9.10
생방중 4000명이 소름돋은 해킹핵에 당했습니다... [어몽어스 19화],쉐어TV,16.9만명,443082,2020.9.8
임포스터 한테 절대 안죽는 방법 [어몽어스],JUNE,53.4만명,580066,2020.8.31
어몽어스 애니메이션 - 고인물 vs 뉴비 (임포스터편),배화,4.4만명,1762109,2020.9.19
참여자 전원이 맵핵을 키고하는 미쳐버린 어몽어스 맵핵모드ㅋㅋㅋ,김계정,42만명,392539,2020.9.26
내가 임포 걸렸을때 대처하는 자세 [어몽어스],JUNE,53.4만명,216186,2020.9.4
모르는 사람과 벤트쇼로 레전드 찍은 유튜버 [어몽어스],주키니TV,38.7만명,1371787,2020.9.1
통신실 사보타지로 레전드를 쓴 역대급 미친 임포스터 [어몽어스],주키니TV,38.7만명,1319335,2020.9.9
어몽어스가 인성파괴 게임인 이유,킴성태TV,100만명,821690,2020.8.21
임포스터보다 시민이 더 재미있는 이유?! 임포 농락 꿀잼 ㅋㅋㅋ [어몽어스],킴성태TV,100만명,429270,2020.9.20
보안실로 들어오면 다 죽이는 미친 임포스터 ㅋㅋㅋㅋㅋ [어몽어스],윤루트,23.5만명,25743,2020.9.22
어몽어스할 때 꼭 있는 16가지 유형ㅋㅋㅋㅋ,웃소 Wootso,137만명,2605285,2020.8.29
임포스터가 없는데 누구를 잡으라는 거지? [어몽어스],주키니TV,38.7만명,851565,2020.9.7
어몽어스에서 일어난 사랑과 전쟁 - 어몽어스 고멤합방,우왁굳의 게임방송,106만명,635931,2020.9.12
(꼭해보세요) 합법적 버그로 초보 임포스터도 100% 이기는 방법 [어몽어스 25화],쉐어TV,16.9만명,367105,2020.9.16
어몽어스 임포스터 찾는법 ㅋㅋ,꿀탱탱,48.2만명,595066,2020.9.7
물 만난 정치왕 저라뎃 【어몽어스 하이라이트】,저라뎃 JUSTLIKETHAT,54.8만명,307054,2020.8.29
어몽어스하면서 가장 설레는순간 CCTV.,도현,22.9만명,258990,2020.9.8
망원경으로 크루원 싹 다 속이는 방법ㅋㅋ 개레전드 _ 어몽어스,자몽티비,47.5만명,90554,2020.9.24
이게 어몽어스야 공포게임이야,SUNBA선바,81.6만명,588643,2020.9.3
MIRA HQ 사진에 담긴 소름끼치는 의미..!! | 어몽어스 스토리 1화,힘쎈너구리,20.1만명,234172,2020.9.18
살인하면 화면이 굳어버리는 버그?! [어몽어스],킴성태TV,100만명,383479,2020.9.9
Pa Ran Saeg I Imposter Eyo! - 어몽어스(Among Us) 오클랜드대학 특집 풀영상,두번째 빅헤드,3.47만명,4666,2020.9.26
임포스터가 어려우세요? 대놓고 죽여도 안걸리는 법 알려드립니다,혜안,80만명,1139698,2020.9.7
제가 죽였는데 국밥 둘이서 계속 싸우네요 ㅋㅋㅋㅋㅋ [어몽어스],킴성태TV,100만명,499927,2020.8.30
이럴수가..초등학생한테 어몽어스 개 털렸습니다... - 잼몽어스 3화,우왁굳의 게임방송,106만명,320433,2020.9.18
눈앞에서 킬하고 농락하는 임포스터;; [어몽어스],킴성태TV,100만명,489576,2020.8.28
죄송합니다. 투명핵 썼습니다. [어몽어스],킴성태TV,100만명,406440,2020.9.23
어몽어스에서 절대 의심받지 않는 소름돋는 중국인 임포스터,주키니TV,38.7만명,1000421,2020.8.20
어몽어스 가장 극혐미션은?! (어몽어스 이상형 월드컵),왈도쿤,19.8만명,20904,2020.9.26
2분 만에 전부 죽이는 빅헤드 & 중력의 레전드 플레이ㅣ어몽어스,빅헤드,47.5만명,1914521,2020.7.28
임포수터 장인｜어몽어스 하이라이트,수찬 Suchan,26.5만명,154806,2020.9.16
코혐있는 임아니 feat. 어몽어스,임아니[임아니TV],2.72만명,68306,2020.9.19
(공감주의) 어몽어스 할 때 가장 쪽팔리는 순간;,혜안,80만명,508609,2020.9.6
어몽어스 만화 - 민트 & 민트베이비의 이야기 ㅠㅠ 크루원의 실제 시점...?,휴지,44.8만명,122830,2020.9.25
닉네임 적는대로 다되는 말도안되는 일이 벌어졌습니다. 우주하마 어몽어스,우주하마,105만명,1506046,2020.8.25
삼촌;; 어몽어스 그렇게 하는거 아니에여 ㅠㅠ 답답해!! (Feat. 마이린&노래하는하람),뚜빠와 게임을 즐겁게,1.98만명,14260,2020.9.26
어몽어스 애니메이션 3화 AMONG US ANIMATION EP3,ONTHECAT 온더캣,2.89만명,642744,2020.9.20
대놓고 킬했는데 이걸 못보네?ㅋㅋㅋㅋㅋㅋ ｜어몽어스 하이라이트,수찬 Suchan,26.5만명,142380,2020.9.1
어몽어스 느린 술래잡기 🐢 젖먹던 힘으로 1cm 도망 ㅋㅋㅋㅋㅋ,지컨,19.8만명,53650,2020.9.23
애들아 나 임포스터야.. 관심 좀... 임포스터라니까? - 어몽어스(Among us) - 겜브링(GGAMBRING),겜브링 GGAM BRING,102만명,276924,2020.9.18
임포스터 어떻게 하는지 알았습니다 - 어몽어스 고멤합방,우왁굳의 게임방송,106만명,511129,2020.9.9
(꿀팁!!) 킬하고 대놓고 숨어도 찾을수 없는 은신 임포스터 [어몽어스 21화],쉐어TV,16.9만명,386286,2020.9.11
한곳에서만 계속 죽이는 저이코패스 【어몽어스 하이라이트】,저라뎃 JUSTLIKETHAT,54.8만명,327963,2020.9.4
어몽어스 처음하는 아저씨인척 해보세요 시민들이 지켜줌ㅋㅋㅋㅋㅋ,혜안,80만명,986395,2020.8.29
어몽어스가 내 인생에 도움 되는 이유 / 스브스뉴스,스브스뉴스 SUBUSU NEWS,59만명,461410,2020.9.19
어몽어스 너무 잘해서 쌍욕 먹었습니다 ;,혜안,80만명,1192427,2020.8.14
오버워치 어몽어스모드 퀄리티 대박임ㅋㅋㅋ,김재원의 즐거운 세상,164만명,554815,2020.9.20
박스로 만든 어몽어스 킬모션 오토마타 | 당기면 자동으로 칼 연타를 한다!? | Making Among us kill Automata with Cardboard,바이준 BYJUN,6.32만명,1558428,2020.9.21
프로포즈했다차인사람 위로해주다가 멸망한 착한 시민들ㅠㅠ 어몽어스,우주하마,105만명,1361135,2020.8.29
어몽어스 도중 한명만 골라서 죽이면 일어나는일 ㅋㅋㅋㅋ,코아 TV,64만명,557498,2020.8.19
어몽어스 합법적 핵으로 같은 색 누명 씌우는 방법 ㅋㅋㅋ,안내메시지,11.7만명,92030,2020.9.12
어몽어스 처음이라 아무것도 모르는뎅 ㅎㅎ 죽였당 ㅎㅎ,코아 TV,64만명,667356,2020.8.14
임포스터가 제일 재밌을 때 ㅋㅋㅋ 걸뽀 어몽어스,걸뽀girlbbo,30.7만명,76926,2020.9.13
바보컨셉으로 90초컷 실화?! 역대급 핵병맛 어몽어스 플레이ㅋㅋ 어몽어스,자몽티비,47.5만명,171246,2020.8.21
소름 돋는 IQ 600 임포스터 레전드 잘하는 법 [ 어몽어스 ],재민TV,45.2만명,57680,2020.9.20
모두가 놀란 킴성태의 슈퍼플레이!! 혼자 다 끝내버림.. [어몽어스],킴성태TV,100만명,595813,2020.9.5
사플로 임포스터 다 잡아서 핵 친플 의심받는 유튜버 어몽어스,살타 Salta,8.31만명,261746,2020.9.13
마! 살아있네! - 어몽어스(Among Us) 범죄자 특집 풀영상,두번째 빅헤드,3.47만명,12954,2020.9.24
어몽어스 애니메이션 - 고인물 vs 뉴비 (크루원편),배화,4.4만명,1581051,2020.9.12
※아파트 PC방※ 실제 친구들끼리 모여서 어몽어스를 한다면ㅋㅋㅋㅋ 그만 훔쳐보라고!!,악동 김블루,177만명,546116,2020.9.21
